"season","episode","number_line","timecode_in","timecode_out","text"
"1","3","1","00:00:49:09","00:00:52:12","I forbid anyone from opening
his gate of energy!"
"1","3","2","00:00:59:17","00:01:00:17","Wait!"
"1","3","3","00:01:03:01","00:01:05:02","You cannot just leave like this."
"1","3","4","00:01:05:17","00:01:07:10","What about this child?"
"1","3","5","00:01:07:23","00:01:11:07","Think about what people will say
about Do-hwa and this baby."
"1","3","6","00:01:11:20","00:01:13:16","They will say he is not your son"
"1","3","7","00:01:14:13","00:01:16:24","and call him an illegitimate child."
"1","3","8","00:01:17:18","00:01:21:11","He will be raised by the Jang family
since my wife gave birth to him."
"1","3","9","00:01:22:02","00:01:24:12","I will send someone over
after his mother's funeral."
"1","3","10","00:01:24:14","00:01:26:01","Are you abandoning this child?"
"1","3","11","00:01:27:10","00:01:28:14","Is he really"
"1","3","12","00:01:29:09","00:01:30:22","not your son?"
"1","3","13","00:01:33:07","00:01:35:11","Believe what you wish to believe."
"1","3","14","00:01:38:06","00:01:40:12","If this child is
only going to cause trouble,"
"1","3","15","00:01:40:13","00:01:42:07","let us just end his life here and now."
"1","3","16","00:01:52:00","00:01:54:12","See? He is your son."
"1","3","17","00:01:54:14","00:01:59:10","A son you are willing to protect
even at the risk of your own life."
"1","3","18","00:01:59:24","00:02:01:18","I am merely trying to keep him safe."
"1","3","19","00:02:03:11","00:02:06:19","If his gate of energy remains closed
and he lives as my son, he will live."
"1","3","20","00:02:07:07","00:02:10:10","However, if he chooses
to discover his fate instead,"
"1","3","21","00:02:12:00","00:02:13:16","he will not survive."
"1","3","22","00:02:15:19","00:02:18:06","Who is the father"
"1","3","23","00:02:19:18","00:02:20:21","of that child?"
"1","3","24","00:02:25:09","00:02:27:12","He is the son of a dead man."
"1","3","25","00:02:31:00","00:02:33:02","Not only does his birth make no sense,"
"1","3","26","00:02:33:22","00:02:35:23","but it never should have happened either."
"1","3","27","00:02:41:11","00:02:43:17","Young Master, are you all right?"
"1","3","28","00:02:44:11","00:02:46:20","Why did you bring her out?"
"1","3","29","00:02:46:22","00:02:48:04","Let her go."
"1","3","30","00:03:17:01","00:03:19:04","I apologize for causing trouble."
"1","3","31","00:03:19:06","00:03:21:10","Why did you bring her out?"
"1","3","32","00:03:24:07","00:03:27:02","She tried to poison you."
"1","3","33","00:03:27:17","00:03:29:17","She did not poison me."
"1","3","34","00:03:30:22","00:03:32:09","I poisoned myself."
"1","3","35","00:03:34:24","00:03:38:18","I did it because I hated that
I was incapable of casting spells."
"1","3","36","00:03:39:11","00:03:42:08","My maid only risked her life
by doing what she was told to do."
"1","3","37","00:03:43:16","00:03:45:10","It was all my doing."
"1","3","38","00:03:53:24","00:03:57:00","-Jang Uk, how could you?
-Please save it for another time."
"1","3","39","00:03:57:02","00:04:00:22","He still has not recovered
from the poison."
"1","3","40","00:04:00:24","00:04:04:12","Punish him all you want,
but wait until he has fully recovered."
"1","3","41","00:04:04:14","00:04:06:09","Uk almost died just now."
"1","3","42","00:04:06:11","00:04:08:17","Please do not scold him like that."
"1","3","43","00:04:08:19","00:04:10:11","Look at how pale he is."
"1","3","44","00:04:12:11","00:04:13:23","Take him home for now."
"1","3","45","00:04:14:00","00:04:16:03","Young Master, let us go."
"1","3","46","00:04:16:05","00:04:18:00","Go to Sejukwon and receive treatment."
"1","3","47","00:04:18:02","00:04:19:15","Mu-deok needs to go too."
"1","3","48","00:04:20:05","00:04:21:19","Now is not the time."
"1","3","49","00:04:21:22","00:04:23:20","Mu-deok needs to get treatment too."
"1","3","50","00:04:23:22","00:04:25:11","Otherwise, I will not go."
"1","3","51","00:04:25:13","00:04:26:19","Young Master."
"1","3","52","00:04:26:21","00:04:28:23","Fine. Go ahead and die!"
"1","3","53","00:04:29:00","00:04:31:22","-Lock them back up!
-Calm down, Uncle."
"1","3","54","00:04:31:24","00:04:34:01","If Uk is right,
that maid did nothing wrong."
"1","3","55","00:04:34:22","00:04:36:00","She is severely injured."
"1","3","56","00:04:36:17","00:04:38:07","Without treatment, she could die."
"1","3","57","00:04:38:09","00:04:41:15","I am surprised she is still alive
even after all those beatings."
"1","3","58","00:04:42:04","00:04:44:22","If she dies, I will allow you
to hold a funeral for her."
"1","3","59","00:05:02:11","00:05:03:19","Please help."
"1","3","60","00:05:05:09","00:05:08:10","Mu-deok risked her life
to do what I asked."
"1","3","61","00:05:08:12","00:05:11:02","We need to treat her at Sejukwon
to save her life."
"1","3","62","00:05:12:21","00:05:14:03","Please help her."
"1","3","63","00:05:25:03","00:05:26:16","I want them out of my sight."
"1","3","64","00:05:27:11","00:05:29:15","Take them both to Sejukwon."
"1","3","65","00:05:32:15","00:05:33:13","Uk."
"1","3","66","00:05:36:05","00:05:39:05","Young Master, go on ahead.
I will take Mu-deok there."
"1","3","67","00:05:39:22","00:05:40:18","Mu-deok."
"1","3","68","00:05:41:18","00:05:43:09","Mu-deok, wake up."
"1","3","69","00:06:04:00","00:06:05:13","-I will take her.
-No."
"1","3","70","00:06:06:24","00:06:08:10","I will do it myself."
"1","3","71","00:06:08:12","00:06:09:23","You cannot even walk properly."
"1","3","72","00:06:10:20","00:06:13:17","I can do it. She is my maid,
so I will take her."
"1","3","73","00:06:13:19","00:06:15:10","But you are not well either."
"1","3","74","00:06:15:12","00:06:17:04","You cannot take her there."
"1","3","75","00:06:19:03","00:06:21:04","Do you think so? Then…"
"1","3","76","00:06:22:08","00:06:24:21","-You carry her on your back.
-Pardon?"
"1","3","77","00:06:24:23","00:06:26:05","Carry her on your back."
"1","3","78","00:06:26:21","00:06:28:20","-You want me to carry her?
-Yes."
"1","3","79","00:06:29:09","00:06:31:02","Why should I carry her?"
"1","3","80","00:06:31:04","00:06:32:17","-Come here.
-Young Master."
"1","3","81","00:06:33:04","00:06:35:08","No, but wait. My goodness."
"1","3","82","00:06:35:23","00:06:37:01","Oh, my goodness."
"1","3","83","00:06:37:03","00:06:40:09","Hey, Yul. All right."
"1","3","84","00:06:40:12","00:06:42:01","Help me instead of Mu-deok."
"1","3","85","00:06:44:04","00:06:46:18","I do not have the strength to walk.
Take me to Sejukwon."
"1","3","86","00:06:48:12","00:06:49:24","Do you want me to carry him?"
"1","3","87","00:06:51:18","00:06:54:07","-No.
-All right. Thank you."
"1","3","88","00:06:54:09","00:06:56:03","Maidservant Kim, be careful!"
"1","3","89","00:06:56:05","00:06:57:18","-Be careful with her!
-All right."
"1","3","90","00:06:57:20","00:06:58:17","-Goodness.
-What…"
"1","3","91","00:06:59:11","00:07:00:20","Be careful."
"1","3","92","00:07:01:15","00:07:02:15","Oh, dear."
"1","3","93","00:07:04:02","00:07:05:15","Uk has opened"
"1","3","94","00:07:07:02","00:07:09:16","his gate of energy in the end."
"1","3","95","00:07:10:21","00:07:11:23","Right."
"1","3","96","00:07:13:06","00:07:17:21","He was even willing to end his life.
I could not just sit back and watch."
"1","3","97","00:07:18:16","00:07:21:10","I guess he knew that"
"1","3","98","00:07:21:13","00:07:25:01","we would never just let him kill himself."
"1","3","99","00:07:25:23","00:07:28:13","He probably poisoned himself"
"1","3","100","00:07:28:15","00:07:30:07","knowing he would get saved."
"1","3","101","00:07:34:08","00:07:35:15","Are you all right?"
"1","3","102","00:07:37:21","00:07:40:19","Opening Uk's gate of energy
and treating him"
"1","3","103","00:07:40:21","00:07:43:15","has probably cost me
ten years' worth of energy."
"1","3","104","00:07:44:16","00:07:48:20","So you not only opened his gate of energy,
but you even gave him extra energy?"
"1","3","105","00:07:48:22","00:07:52:10","What good would it be for an old man
to keep his energy saved up?"
"1","3","106","00:07:53:03","00:07:55:03","He was poisoned,"
"1","3","107","00:07:55:05","00:07:57:21","so I gave him some energy
to speed up his recovery."
"1","3","108","00:07:57:23","00:08:01:21","Once Uk recovers,
you must retrieve it no matter what."
"1","3","109","00:08:02:20","00:08:06:03","Is that really necessary
now that his gate of energy is open?"
"1","3","110","00:08:06:18","00:08:10:10","He is at least 20 years behind
when it comes to knowing spells."
"1","3","111","00:08:10:12","00:08:12:22","Even if he begins training himself now,"
"1","3","112","00:08:13:10","00:08:17:18","he will at least have to be 60
to do anything impressive."
"1","3","113","00:08:17:20","00:08:20:16","That is the fate he was given."
"1","3","114","00:08:22:13","00:08:24:01","We must make sure of it."
"1","3","115","00:08:25:19","00:08:29:02","If that is what you wish,
then I will retrieve it."
"1","3","116","00:08:29:04","00:08:30:07","You know what?"
"1","3","117","00:08:31:04","00:08:33:22","I am too exhausted. I need a break."
"1","3","118","00:08:34:15","00:08:36:21","Bring me some wine."
"1","3","119","00:08:40:16","00:08:41:23","Wine?"
"1","3","120","00:08:44:01","00:08:45:02","I mean…"
"1","3","121","00:08:45:23","00:08:49:12","Why would there be wine
in the room of a practitioner?"
"1","3","122","00:08:49:14","00:08:50:20","I saw it."
"1","3","123","00:08:51:20","00:08:54:03","I saw it hidden in your room."
"1","3","124","00:08:54:17","00:08:57:13","Come on. The wine you drink
whenever you get lonely."
"1","3","125","00:08:58:03","00:09:00:13","-I am not lonely!
-My gosh."
"1","3","126","00:09:02:21","00:09:03:20","I am merely…"
"1","3","127","00:09:03:22","00:09:05:03","Gosh, I have a headache."
"1","3","128","00:09:06:00","00:09:07:01","It is because of…"
"1","3","129","00:09:07:03","00:09:08:17","What was it called again?"
"1","3","130","00:09:08:19","00:09:10:07","Right. Insomnia."
"1","3","131","00:09:10:23","00:09:12:17","I have very bad insomnia."
"1","3","132","00:09:14:24","00:09:16:17","I merely take it for that."
"1","3","133","00:09:22:22","00:09:26:11","Loneliness prevents you
from falling asleep."
"1","3","134","00:09:26:14","00:09:28:21","You should have gotten married
when you were young."
"1","3","135","00:09:29:16","00:09:34:14","Are you still not over Do-hwa?
Is that why you are alone?"
"1","3","136","00:09:46:08","00:09:47:10","It is empty."
"1","3","137","00:09:48:07","00:09:49:11","-What?
-You finished it."
"1","3","138","00:09:50:22","00:09:53:06","That is not possible. What?"
"1","3","139","00:09:57:08","00:09:58:12","What in the world…"
"1","3","140","00:09:58:14","00:10:01:05","I guess you were unbelievably lonely."
"1","3","141","00:10:01:07","00:10:04:08","I only had a glass
every time I could not sleep."
"1","3","142","00:10:04:24","00:10:06:13","I only had one glass each time…"
"1","3","143","00:10:13:08","00:10:16:19","This is the wine that
my uncle hides in his room."
"1","3","144","00:10:16:21","00:10:18:12","It tastes quite nice."
"1","3","145","00:10:19:06","00:10:22:17","Anyway, Uk's life-long dream
has finally come true."
"1","3","146","00:10:22:19","00:10:24:00","So let us celebrate."
"1","3","147","00:10:24:13","00:10:26:05","That girl, Mu-deok…"
"1","3","148","00:10:26:07","00:10:28:08","He recently brought her
from a brothel, right?"
"1","3","149","00:10:30:03","00:10:33:08","She risked her life for him
even though they only just met."
"1","3","150","00:10:35:14","00:10:36:16","It is strange."
"1","3","151","00:10:36:17","00:10:39:13","Uk saved her
from having to become a gisaeng."
"1","3","152","00:10:39:15","00:10:42:23","She hated it so much that
she even pretended to be blind."
"1","3","153","00:10:43:00","00:10:44:17","Have a drink."
"1","3","154","00:10:44:19","00:10:45:24","""Blind""?"
"1","3","155","00:10:46:16","00:10:50:02","Yes. According to Ju-wol,
she was blind when she came"
"1","3","156","00:10:50:04","00:10:52:01","but could see just fine when she left."
"1","3","157","00:10:52:03","00:10:54:01","The wine tastes great."
"1","3","158","00:10:55:23","00:10:57:09","She easily deceives people."
"1","3","159","00:10:58:10","00:11:01:15","She lied about being blind
and even said she poisoned Uk."
"1","3","160","00:11:02:23","00:11:05:06","She did not speak
even though she was tortured."
"1","3","161","00:11:05:19","00:11:07:11","There is more to her than meets the eye."
"1","3","162","00:11:07:13","00:11:10:02","On the outside,
she just looks cute and naive."
"1","3","163","00:11:10:04","00:11:12:10","She seems to be hiding something."
"1","3","164","00:11:19:04","00:11:21:20","-You finished it.
-What? What about it?"
"1","3","165","00:11:23:04","00:11:25:14","Your uncle is on his way here,"
"1","3","166","00:11:25:16","00:11:27:03","so I am guessing you are doomed."
"1","3","167","00:11:28:05","00:11:30:19","-I did not drink any.
-Wait. Yul."
"1","3","168","00:11:30:21","00:11:31:23","Yul!"
"1","3","169","00:11:34:17","00:11:36:01","-Oh, gosh.
-Dang-gu."
"1","3","170","00:11:38:03","00:11:39:12","I am dead."
"1","3","171","00:11:41:10","00:11:42:13","Dang-gu."
"1","3","172","00:11:44:12","00:11:45:15","It was you, right?"
"1","3","173","00:11:46:08","00:11:47:06","No."
"1","3","174","00:11:52:13","00:11:53:22","Come here."
"1","3","175","00:11:54:16","00:11:56:13","-Dang-gu.
-Yes, Uncle?"
"1","3","176","00:12:06:04","00:12:07:14","Is she breathing?"
"1","3","177","00:12:13:15","00:12:14:18","You are awake."
"1","3","178","00:12:15:13","00:12:17:22","You kept passing out,
so I thought you might die."
"1","3","179","00:12:21:14","00:12:22:16","Gosh."
"1","3","180","00:12:24:20","00:12:26:01","Does it hurt a lot?"
"1","3","181","00:12:27:03","00:12:29:06","I think I broke my bones."
"1","3","182","00:12:29:20","00:12:31:02","They said you were fine."
"1","3","183","00:12:32:03","00:12:33:17","-Really?
-Yes."
"1","3","184","00:12:34:06","00:12:36:15","Then why does it hurt so much?"
"1","3","185","00:12:36:17","00:12:38:05","What a useless body."
"1","3","186","00:12:40:02","00:12:41:05","Hey."
"1","3","187","00:12:43:07","00:12:45:04","Why did you say you poisoned me?"
"1","3","188","00:12:46:07","00:12:48:15","If you pretended like
you did not know anything,"
"1","3","189","00:12:48:18","00:12:50:11","they would not have tortured you."
"1","3","190","00:12:52:00","00:12:54:10","I had to make them believe
that you were dying."
"1","3","191","00:12:54:23","00:12:57:13","Otherwise, they would not have
opened your gate of energy."
"1","3","192","00:12:58:04","00:13:00:00","They just would have made an antidote."
"1","3","193","00:13:01:14","00:13:03:15","So you really did risk your life."
"1","3","194","00:13:06:21","00:13:09:12","I thought I might lose
at least an arm or a leg."
"1","3","195","00:13:10:07","00:13:11:23","But I am surprisingly fine."
"1","3","196","00:13:12:01","00:13:14:11","The people of Songrim are too nice."
"1","3","197","00:13:14:13","00:13:16:08","If this is how they torture people…"
"1","3","198","00:13:19:08","00:13:20:10","By the way,"
"1","3","199","00:13:21:06","00:13:23:17","you still seem pretty sick yourself."
"1","3","200","00:13:24:05","00:13:25:13","Why are you here?"
"1","3","201","00:13:26:20","00:13:29:02","Obviously to take care of you."
"1","3","202","00:13:29:24","00:13:32:04","All the practitioners here are mages."
"1","3","203","00:13:32:06","00:13:33:21","They cannot find out about you."
"1","3","204","00:13:34:10","00:13:38:00","So I closed the door
when no one was looking,"
"1","3","205","00:13:38:02","00:13:41:15","changed your clothes for you,
applied ointment on your wounds,"
"1","3","206","00:13:41:17","00:13:44:04","and gave you a massage
whenever you passed out."
"1","3","207","00:13:45:11","00:13:47:18","-You did?
-Yes."
"1","3","208","00:13:52:04","00:13:55:24","I am the only person who is safe enough
to come this close to you."
"1","3","209","00:14:27:01","00:14:28:08","All my life,"
"1","3","210","00:14:29:05","00:14:32:02","no one ever seemed to know
how desperate I was."
"1","3","211","00:14:34:23","00:14:36:22","No one has ever risked their lives for me"
"1","3","212","00:14:38:02","00:14:39:10","like you did."
"1","3","213","00:14:52:19","00:14:55:23","Since I survived as promised,"
"1","3","214","00:14:56:00","00:14:58:04","I will serve you as my master."
"1","3","215","00:15:06:08","00:15:08:18","Up until now, I have served 12 masters."
"1","3","216","00:15:09:11","00:15:12:18","People think I got kicked out every time,
but I was the one who left."
"1","3","217","00:15:15:03","00:15:17:22","But now, I have
finally found my true master."
"1","3","218","00:15:18:11","00:15:20:21","So I shall kneel before you"
"1","3","219","00:15:20:24","00:15:23:05","and swear to serve you
as my master forever."
"1","3","220","00:15:25:08","00:15:26:18","On one condition."
"1","3","221","00:15:29:10","00:15:32:00","Do not tell anyone about our relationship."
"1","3","222","00:15:33:00","00:15:34:24","You will continue to be my owner,"
"1","3","223","00:15:36:06","00:15:38:05","and I will continue to be your maid."
"1","3","224","00:15:41:20","00:15:42:22","Also,"
"1","3","225","00:15:43:16","00:15:47:18","our relationship as master and pupil
will only last until you become the best"
"1","3","226","00:15:47:20","00:15:50:05","and help me get my energy back."
"1","3","227","00:15:52:07","00:15:53:13","Only until then."
"1","3","228","00:15:55:00","00:15:57:24","The moment I get my energy back
and become Naksu again,"
"1","3","229","00:16:00:00","00:16:02:13","we will no longer be master and pupil."
"1","3","230","00:16:03:14","00:16:05:10","Can you tell me why?"
"1","3","231","00:16:08:21","00:16:10:02","Because then,"
"1","3","232","00:16:11:02","00:16:13:11","you should no longer
have a reason to protect me,"
"1","3","233","00:16:14:12","00:16:16:08","nor should I have a reason…"
"1","3","234","00:16:19:16","00:16:21:01","to go easy on you."
"1","3","235","00:16:30:01","00:16:32:17","So you want to part ways
once our business is done?"
"1","3","236","00:16:33:09","00:16:34:10","I see."
"1","3","237","00:16:37:08","00:16:38:10","All right."
"1","3","238","00:16:39:00","00:16:41:21","Once I am no longer of use to you,
you may abandon me."
"1","3","239","00:16:41:23","00:16:44:14","Then I will respect your decision
and let you leave."
"1","3","240","00:16:51:02","00:16:53:13","Now, kneel before your master."
"1","3","241","00:17:00:19","00:17:02:02","I, Jang Uk, your pupil,"
"1","3","242","00:17:02:20","00:17:05:17","will serve and protect my master, Mu-deok,
with all my heart."
"1","3","243","00:18:25:09","00:18:27:12","You have returned to your true self."
"1","3","244","00:18:35:03","00:18:37:10","You will not run wild for a while."
"1","3","245","00:18:37:23","00:18:41:07","Then I shall meet you in the royal palace."
"1","3","246","00:18:50:11","00:18:53:01","Feeding human souls
to soul shifters who run wild"
"1","3","247","00:18:53:03","00:18:55:03","allow them to continue to be of use."
"1","3","248","00:18:57:07","00:19:00:05","Did you kill the gisaeng
that Naksu's soul has shifted into?"
"1","3","249","00:19:00:07","00:19:02:19","Yes, we threw the body away
in Lake Gyeongcheondaeho."
"1","3","250","00:19:02:21","00:19:04:21","Did you check for the blue mark?"
"1","3","251","00:19:10:05","00:19:11:19","There is no blue mark."
"1","3","252","00:19:13:03","00:19:14:14","She is not Naksu."
"1","3","253","00:19:16:13","00:19:18:17","Yes, I checked."
"1","3","254","00:19:18:19","00:19:22:06","The Naksu I used to know
would not have lost to you,"
"1","3","255","00:19:22:22","00:19:25:15","but she must have lost her energy
due to the body she is in."
"1","3","256","00:19:26:04","00:19:29:11","Do soul shifters sometimes lose energy?"
"1","3","257","00:19:30:14","00:19:31:21","If a soul is too strong,"
"1","3","258","00:19:31:24","00:19:36:10","it enters an unbefitting body
and cannot access its energy."
"1","3","259","00:19:36:12","00:19:38:06","Have you seen that before?"
"1","3","260","00:19:47:06","00:19:48:10","Your Majesty."
"1","3","261","00:19:48:13","00:19:50:06","I am Master Jang's pupil, Jin Mu."
"1","3","262","00:19:50:08","00:19:52:04","I heard you asked for me."
"1","3","263","00:20:02:14","00:20:03:14","Jin Mu."
"1","3","264","00:20:04:12","00:20:05:14","Yes, Your Majesty."
"1","3","265","00:20:05:16","00:20:08:19","I am not the king.
I am your master, Jang Gang."
"1","3","266","00:20:09:12","00:20:12:07","Right now, my soul has shifted
into the king's body."
"1","3","267","00:20:22:09","00:20:25:00","Master, is that you?"
"1","3","268","00:20:25:02","00:20:28:13","Yes, the king and I have switched bodies."
"1","3","269","00:20:29:04","00:20:31:00","Then where is His Majesty?"
"1","3","270","00:20:31:02","00:20:32:22","His soul is inside my body."
"1","3","271","00:20:33:12","00:20:35:14","I must get my body back."
"1","3","272","00:20:36:03","00:20:38:16","But I cannot seem to retrieve my energy."
"1","3","273","00:20:38:18","00:20:41:12","I need you to help me."
"1","3","274","00:20:43:05","00:20:44:07","Master."
"1","3","275","00:20:44:20","00:20:47:18","I do not know
how the alchemy of souls works."
"1","3","276","00:20:48:14","00:20:52:14","Go to the Cheonbugwan Secret Room
and bring me the Soul Ejector."
"1","3","277","00:20:53:02","00:20:56:05","I shall teach you the alchemy of souls."
"1","3","278","00:20:58:23","00:21:02:00","He could not retrieve his energy
due to the weak body he was in,"
"1","3","279","00:21:02:02","00:21:04:02","which was why I was given a chance."
"1","3","280","00:21:05:13","00:21:07:01","I was lucky."
"1","3","281","00:21:09:11","00:21:11:11","Burn these bodies."
"1","3","282","00:21:30:07","00:21:35:03","Search the brothel that
the dead gisaeng used to work at."
"1","3","283","00:21:35:17","00:21:38:03","Find the owner of the Spirit Plaque,"
"1","3","284","00:21:39:05","00:21:40:18","and do it discreetly."
"1","3","285","00:21:41:08","00:21:42:09","Yes, sir."
"1","3","286","00:21:57:03","00:21:58:11","What are you doing?"
"1","3","287","00:22:00:14","00:22:01:14","It is cold."
"1","3","288","00:22:02:06","00:22:04:05","It is freezing."
"1","3","289","00:22:04:08","00:22:07:02","Of course, it is cold.
So why are you sitting there?"
"1","3","290","00:22:09:14","00:22:12:01","I have never felt this cold before."
"1","3","291","00:22:12:18","00:22:15:22","I would easily collapse
because my gate of energy was closed."
"1","3","292","00:22:16:00","00:22:18:05","Even though I am shivering, I can stand."
"1","3","293","00:22:18:07","00:22:20:23","I guess my gate of energy
is really open now."
"1","3","294","00:22:21:01","00:22:23:11","If you master your spells,
you will neither feel cold on ice"
"1","3","295","00:22:23:13","00:22:25:00","nor hot walking on fire."
"1","3","296","00:22:25:17","00:22:27:24","What were you like
before you shifted souls?"
"1","3","297","00:22:28:01","00:22:30:11","I had heard many rumors
since you were so infamous."
"1","3","298","00:22:31:06","00:22:32:13","But I never actually saw you myself."
"1","3","299","00:22:32:16","00:22:34:23","I heard you were pretty strong."
"1","3","300","00:22:36:08","00:22:40:18","I was not just strong.
I was extremely strong."
"1","3","301","00:22:41:10","00:22:43:00","""Extremely""? I see."
"1","3","302","00:22:43:02","00:22:46:16","In order to become the best mage,
you must go through several steps."
"1","3","303","00:22:48:18","00:22:51:08","First is Jipsu, the ability
to gather the energy of water."
"1","3","304","00:22:57:04","00:23:00:04","Second is Ryusu, the ability
to gain energy from the flow of water."
"1","3","305","00:23:01:18","00:23:03:17","Then comes Chisu,
the ability to control the energy"
"1","3","306","00:23:06:02","00:23:07:05","in the atmosphere."
"1","3","307","00:23:07:23","00:23:11:09","I am a mage
who has mastered all three steps."
"1","3","308","00:23:11:11","00:23:14:03","Not many in Daeho have mastered all three."
"1","3","309","00:23:14:18","00:23:17:23","I guess you really did
live up to your name."
"1","3","310","00:23:18:17","00:23:19:18","Yes."
"1","3","311","00:23:20:13","00:23:22:19","I moved silently like a shadow,"
"1","3","312","00:23:23:12","00:23:27:11","and the heads of my enemies
fell to the ground where I passed."
"1","3","313","00:23:28:03","00:23:29:17","I was Naksu,"
"1","3","314","00:23:30:23","00:23:32:13","the Shadow Assassin."
"1","3","315","00:23:45:10","00:23:47:10","I walked on water like I was flying,"
"1","3","316","00:23:48:09","00:23:50:17","and the wind blew as I passed by."
"1","3","317","00:24:08:08","00:24:11:21","If I did this, it would rain."
"1","3","318","00:24:15:18","00:24:19:11","I am Naksu, the best mage in this land,"
"1","3","319","00:24:20:01","00:24:23:01","who even has the ability
to create snow and rain…"
"1","3","320","00:24:27:02","00:24:28:10","Are you all right?"
"1","3","321","00:24:30:14","00:24:32:01","All I did was run for a bit,"
"1","3","322","00:24:32:22","00:24:35:23","but it feels like
my lungs are going to explode."
"1","3","323","00:24:40:20","00:24:41:18","What is the matter?"
"1","3","324","00:24:41:20","00:24:43:22","I have cramps!"
"1","3","325","00:24:43:24","00:24:44:23","You have cramps?"
"1","3","326","00:24:45:00","00:24:48:05","These legs are short, skinny, weak,
and cannot stand the cold."
"1","3","327","00:24:49:00","00:24:50:21","What a useless body."
"1","3","328","00:24:52:22","00:24:56:18","Be careful. You are no longer Naksu,
the Shadow Assassin."
"1","3","329","00:24:56:20","00:24:58:21","You are Mu-deok, our family maid."
"1","3","330","00:24:58:23","00:25:02:01","You should not run around
like you did earlier."
"1","3","331","00:25:02:18","00:25:03:18","You could get hurt."
"1","3","332","00:25:05:03","00:25:06:16","I feel miserable."
"1","3","333","00:25:10:15","00:25:12:19","Do not feel miserable. You have me."
