"season","episode","number_line","timecode_in","timecode_out","text"
"1","3","334","00:25:12:21","00:25:15:20","Let us begin training
now that my gate of energy is open."
"1","3","335","00:25:15:22","00:25:18:03","But first, put your shoes back on.
It is cold."
"1","3","336","00:25:33:07","00:25:34:16","What was that for?"
"1","3","337","00:25:35:06","00:25:36:13","You are not agile."
"1","3","338","00:25:37:22","00:25:38:18","Pick it up."
"1","3","339","00:25:42:04","00:25:43:07","What are you doing?"
"1","3","340","00:25:44:07","00:25:47:17","Let me see how good my pupil is
so I can forget how miserable I feel."
"1","3","341","00:25:47:19","00:25:48:23","What?"
"1","3","342","00:26:02:08","00:26:03:16","Why did you hit me?"
"1","3","343","00:26:03:18","00:26:05:18","You have no swordsmanship."
"1","3","344","00:26:06:05","00:26:07:08","Then show me how you fight."
"1","3","345","00:26:23:16","00:26:24:16","You little…"
"1","3","346","00:26:25:06","00:26:26:07","Gosh, that hurts."
"1","3","347","00:26:38:20","00:26:40:08","You fight poorly too."
"1","3","348","00:26:42:01","00:26:44:13","You are worse than what I had expected."
"1","3","349","00:26:44:16","00:26:47:12","That is because I never learned properly!"
"1","3","350","00:26:51:16","00:26:53:15","You had 12 masters."
"1","3","351","00:26:54:05","00:26:56:17","You may not have been able
to learn how to cast spells,"
"1","3","352","00:26:56:19","00:27:00:04","but you could have learned
basic martial arts."
"1","3","353","00:27:00:06","00:27:02:10","I did not feel motivated to do so."
"1","3","354","00:27:02:12","00:27:03:12","As you already know,"
"1","3","355","00:27:03:14","00:27:05:20","I need to feel motivated
in order to do something."
"1","3","356","00:27:06:16","00:27:07:20","Because you are lazy."
"1","3","357","00:27:08:08","00:27:12:02","I have noticed that
you never do anything around the house."
"1","3","358","00:27:12:04","00:27:14:07","I know everything by heart. Test me."
"1","3","359","00:27:14:09","00:27:16:00","How do you think I recognized you?"
"1","3","360","00:27:16:02","00:27:18:15","It was because I saw you using Tansu.
I know it all."
"1","3","361","00:27:19:02","00:27:20:08","You are all talk."
"1","3","362","00:27:20:10","00:27:21:23","I can do more than talk now."
"1","3","363","00:27:24:19","00:27:26:15","Did you just see that?"
"1","3","364","00:27:26:18","00:27:28:08","I am a quick learner."
"1","3","365","00:27:28:10","00:27:31:07","I will quickly master Jipsu.
How long does it take?"
"1","3","366","00:27:31:09","00:27:33:13","I was a fast learner,
but I took five years."
"1","3","367","00:27:33:15","00:27:35:10","Those who are slow take 20 years."
"1","3","368","00:27:35:12","00:27:36:15","As for you…"
"1","3","369","00:27:38:03","00:27:40:02","You may master it pretty quickly"
"1","3","370","00:27:40:19","00:27:42:04","since you are Jang Gang's son."
"1","3","371","00:27:43:05","00:27:45:03","What does he have to do with this?"
"1","3","372","00:27:45:05","00:27:48:01","He was a genius
who only took a year to master Jipsu."
"1","3","373","00:27:48:19","00:27:50:02","If you achieve that,"
"1","3","374","00:27:50:04","00:27:52:18","rumors that say
you are not his son will subside."
"1","3","375","00:27:52:20","00:27:54:23","But of course,
I doubt it will be possible."
"1","3","376","00:27:55:11","00:27:57:15","If he took a year,
I will do it in six months."
"1","3","377","00:27:57:17","00:27:59:14","No, I will do it in three months."
"1","3","378","00:28:00:04","00:28:01:00","You are bluffing."
"1","3","379","00:28:01:02","00:28:04:00","I am determined, so do not discourage me."
"1","3","380","00:28:07:23","00:28:10:04","Maidservant Kim asked me
to sweep the entire yard."
"1","3","381","00:28:10:17","00:28:12:04","You have recovered a lot,"
"1","3","382","00:28:12:06","00:28:15:04","and you seem to be doing better,
so help me out."
"1","3","383","00:28:18:03","00:28:19:00","What…"
"1","3","384","00:28:20:20","00:28:22:03","Mu-deok."
"1","3","385","00:28:22:05","00:28:26:14","I am a lazy guy who does not do things
he does not feel motivated to do."
"1","3","386","00:28:28:11","00:28:29:14","Good luck."
"1","3","387","00:28:30:20","00:28:31:23","That little…"
"1","3","388","00:28:32:00","00:28:34:02","-That…
-It is cold. How chilly."
"1","3","389","00:28:34:04","00:28:36:12","That lazy, useless show-off!"
"1","3","390","00:28:36:14","00:28:39:19","It is so chilly. It is way too cold."
"1","3","391","00:28:44:03","00:28:49:01","Master Heo has made
herbal medicine for Uk."
"1","3","392","00:28:49:15","00:28:51:04","It seems to be extremely effective"
"1","3","393","00:28:51:06","00:28:55:01","now that Young Master's
gate of energy is open."
"1","3","394","00:28:56:04","00:29:00:10","Maidservant Kim, you seem very delighted."
"1","3","395","00:29:01:23","00:29:05:07","Are you really that upset
that his gate of energy is open?"
"1","3","396","00:29:07:03","00:29:10:06","You did not do anything
even when he was about to die."
"1","3","397","00:29:11:08","00:29:15:03","If not for Master Heo,
Young Master Jang would have died."
"1","3","398","00:29:15:05","00:29:19:01","He should have looked for a way
to save him without opening his gate."
"1","3","399","00:29:19:03","00:29:20:09","How cold of you."
"1","3","400","00:29:21:04","00:29:24:01","You have always kept a distance
from Young Master Jang."
"1","3","401","00:29:24:03","00:29:25:03","Is it…"
"1","3","402","00:29:26:05","00:29:27:11","because of the rumors?"
"1","3","403","00:29:33:10","00:29:35:09","What rumors?"
"1","3","404","00:29:35:12","00:29:36:18","Of course, you would know."
"1","3","405","00:29:37:13","00:29:39:13","You know that there are
rumors going around"
"1","3","406","00:29:39:15","00:29:42:22","saying you are the father
of Young Master Jang."
"1","3","407","00:29:44:09","00:29:46:23","Do not dare to speak of"
"1","3","408","00:29:48:18","00:29:50:19","such absurd rumors!"
"1","3","409","00:29:51:17","00:29:53:12","It is not completely absurd."
"1","3","410","00:29:53:14","00:29:56:17","Let us be honest. We both know that"
"1","3","411","00:29:56:19","00:29:59:15","you used to fancy Madam Do-hwa
before she got married."
"1","3","412","00:30:00:05","00:30:03:23","You used to write her poems
and give her gifts."
"1","3","413","00:30:04:00","00:30:05:04","I am a living witness."
"1","3","414","00:30:05:23","00:30:09:05","People say you are still single
because you are not yet over her."
"1","3","415","00:30:10:02","00:30:11:13","What about you, Maidservant Kim?"
"1","3","416","00:30:12:05","00:30:14:23","Are you still head over heels
for Jang Gang?"
"1","3","417","00:30:15:13","00:30:19:05","Is that why you are unmarried
and still living in his house?"
"1","3","418","00:30:19:21","00:30:20:17","What?"
"1","3","419","00:30:20:19","00:30:24:18","I know very well
how much you used to like him."
"1","3","420","00:30:26:01","00:30:28:03","When he told you that
he liked acorn jelly,"
"1","3","421","00:30:28:05","00:30:29:23","you climbed mountains to collect acorns"
"1","3","422","00:30:30:00","00:30:31:23","-like some kind of a squirrel.
-A squirrel?"
"1","3","423","00:30:32:00","00:30:34:10","I saw you going around collecting acorns."
"1","3","424","00:30:38:13","00:30:39:13","What is your point?"
"1","3","425","00:30:40:14","00:30:44:20","Are you making fun of the fact that
I went around collecting acorns?"
"1","3","426","00:30:47:03","00:30:48:07","Fine!"
"1","3","427","00:30:48:23","00:30:51:10","I admit I went here and there
to collect acorns."
"1","3","428","00:30:52:00","00:30:55:21","Making acorn jelly was the only way
I could express my feelings for him."
"1","3","429","00:30:56:18","00:30:59:01","You can mock me all you want."
"1","3","430","00:31:06:10","00:31:07:12","I am not mocking you."
"1","3","431","00:31:09:11","00:31:11:15","Seeing you make all that acorn jelly…"
"1","3","432","00:31:13:13","00:31:14:20","made me feel sad."
"1","3","433","00:31:17:09","00:31:19:02","I know how it feels"
"1","3","434","00:31:19:17","00:31:22:20","to be in a situation
where you cannot do anything"
"1","3","435","00:31:23:13","00:31:24:19","for the person you love."
"1","3","436","00:31:27:04","00:31:28:07","Other people can say"
"1","3","437","00:31:28:24","00:31:31:14","what they want to say about us
behind our backs,"
"1","3","438","00:31:32:05","00:31:35:16","but let us not do the same to each other."
"1","3","439","00:31:38:05","00:31:41:14","It is obvious to us both
that the passionate love we had"
"1","3","440","00:31:42:20","00:31:45:09","back when we were young"
"1","3","441","00:31:46:24","00:31:48:22","only ended up
leaving a scar in our hearts."
"1","3","442","00:31:53:21","00:31:57:07","I got too worked up
about Young Master Jang"
"1","3","443","00:31:58:04","00:32:00:06","and said things I should not have said."
"1","3","444","00:32:00:08","00:32:01:15","Forgive me."
"1","3","445","00:32:03:02","00:32:05:22","I also care for Uk greatly."
"1","3","446","00:32:06:00","00:32:09:16","I am just afraid that
opening his gate of energy"
"1","3","447","00:32:10:16","00:32:14:07","might have broken the barrier
that is protecting him."
"1","3","448","00:32:14:09","00:32:16:12","It just makes me feel anxious."
"1","3","449","00:32:17:14","00:32:19:24","I may have to break his will"
"1","3","450","00:32:21:20","00:32:24:11","and stop him in the future."
"1","3","451","00:32:26:22","00:32:29:07","Please do not resent me for that."
"1","3","452","00:32:31:17","00:32:32:24","Let us see how things go."
"1","3","453","00:32:40:21","00:32:43:14","Young Master, this is wild ginseng tea."
"1","3","454","00:32:44:04","00:32:45:11","Drink up."
"1","3","455","00:32:45:13","00:32:46:16","""Wild ginseng""?"
"1","3","456","00:32:47:07","00:32:49:00","I will drink it after I return. Leave it."
"1","3","457","00:32:49:02","00:32:50:06","Are you trying"
"1","3","458","00:32:50:21","00:32:52:10","to give it to Mu-deok again?"
"1","3","459","00:32:53:00","00:32:55:16","It is cold outside.
She deserves something nice and warm."
"1","3","460","00:32:56:11","00:32:59:00","Why did you make her
sweep the yard out in the cold?"
"1","3","461","00:33:00:08","00:33:01:10","Wait."
"1","3","462","00:33:02:07","00:33:04:15","That maid is getting treated for free."
"1","3","463","00:33:04:17","00:33:06:15","So I asked her to do her part."
"1","3","464","00:33:06:17","00:33:09:12","Why does it have to be her?
Could you not do it instead?"
"1","3","465","00:33:10:16","00:33:13:13","I need to heat up your medicine,
prepare your meals,"
"1","3","466","00:33:13:15","00:33:14:18","and take care of you."
"1","3","467","00:33:14:20","00:33:17:07","Mu-deok will take care of me.
You do not need to worry."
"1","3","468","00:33:20:11","00:33:21:17","Oh, I see."
"1","3","469","00:33:21:19","00:33:24:00","So you only care about Mu-deok."
"1","3","470","00:33:25:12","00:33:27:02","Since I am now considered useless,"
"1","3","471","00:33:27:04","00:33:30:23","I will go outside
and sweep the yard just like Mu-deok."
"1","3","472","00:33:33:19","00:33:38:09","It is just that I feel like
I am putting you through a lot."
"1","3","473","00:33:38:11","00:33:41:14","How long did it take for you
to boil this wild ginseng?"
"1","3","474","00:33:41:16","00:33:43:13","I boiled it for the entire day."
"1","3","475","00:33:43:15","00:33:46:03","That is my point.
You did not get to sleep a wink."
"1","3","476","00:33:46:05","00:33:48:22","How do you think that makes me feel?"
"1","3","477","00:33:50:02","00:33:51:23","-Not good.
-Right?"
"1","3","478","00:33:52:00","00:33:55:11","I know I put you through a lot
with all the trouble I caused."
"1","3","479","00:33:56:20","00:34:00:22","Look at how tired you look.
You used to have porcelain skin."
"1","3","480","00:34:01:14","00:34:03:17","You should be the one
drinking this wild ginseng tea."
"1","3","481","00:34:03:19","00:34:07:01","So will you stop causing so much trouble?"
"1","3","482","00:34:07:03","00:34:08:23","I do not know what to say to the leader."
"1","3","483","00:34:09:13","00:34:10:24","If he punishes me, so be it."
"1","3","484","00:34:11:13","00:34:14:22","My gates are open now,
which means I will be a part of Songrim."
"1","3","485","00:34:17:15","00:34:21:02","Are you that happy
that your gates of energy are open?"
"1","3","486","00:34:21:18","00:34:23:08","Yes, I am."
"1","3","487","00:34:24:02","00:34:27:03","Once I enter Songrim
and become better than Yul and Dang-gu,"
"1","3","488","00:34:27:05","00:34:29:16","they will regret
not having taken me in sooner."
"1","3","489","00:34:33:16","00:34:35:13","Maidservant Kim, you can have the ginseng."
"1","3","490","00:34:36:07","00:34:38:15","Thank you for the ginseng.
I appreciate it."
"1","3","491","00:34:38:17","00:34:39:20","-Sure.
-Thanks."
"1","3","492","00:34:53:21","00:34:56:18","You must be the spiteful maid."
"1","3","493","00:34:56:20","00:34:58:19","What are you doing? We gave you treatment."
"1","3","494","00:34:58:21","00:35:00:00","Your wounds could get infected."
"1","3","495","00:35:00:02","00:35:02:20","I got treated for free,"
"1","3","496","00:35:02:22","00:35:05:11","so I was told to work to show gratitude."
"1","3","497","00:35:05:13","00:35:07:14","Maidservant Kim is a wise woman."
"1","3","498","00:35:08:01","00:35:11:03","Sweep the yard nice and clean.
Then manure the medicinal herb garden."
"1","3","499","00:35:12:00","00:35:13:00","All right."
"1","3","500","00:35:14:08","00:35:15:14","You just wait, Heo Yeom."
"1","3","501","00:35:15:16","00:35:18:00","Right now, I may be
sweeping your front yard."
"1","3","502","00:35:18:02","00:35:19:24","But one day, I will get rid of Sejukwon."
"1","3","503","00:35:23:12","00:35:25:13","Hey! Watch it."
"1","3","504","00:35:25:15","00:35:27:06","Was that on purpose?"
"1","3","505","00:35:27:21","00:35:28:18","No."
"1","3","506","00:35:28:20","00:35:30:17","I think it was on purpose."
"1","3","507","00:35:30:19","00:35:31:23","That is absurd."
"1","3","508","00:35:36:00","00:35:37:19","You are an odd one."
"1","3","509","00:35:38:14","00:35:39:21","This ear…"
"1","3","510","00:35:39:23","00:35:42:20","I have seen this ear before."
"1","3","511","00:35:45:07","00:35:48:20","Have I ever treated you before?"
"1","3","512","00:35:50:09","00:35:53:11","How would I be able to afford
getting treated at Sejukwon?"
"1","3","513","00:35:56:08","00:35:59:12","This ear looks familiar somehow."
"1","3","514","00:36:04:19","00:36:06:10","Sweep the yard properly."
"1","3","515","00:36:09:14","00:36:10:23","He almost ripped my ear out."
"1","3","516","00:36:11:18","00:36:13:07","I know it hurts, but bear with it."
"1","3","517","00:36:13:09","00:36:16:17","He is angry with Young Master Jang
and is taking it out on you."
"1","3","518","00:36:16:19","00:36:20:23","It is normal to pick on the weak.
That is how the world works."
"1","3","519","00:36:21:00","00:36:23:01","I will just stay quiet."
"1","3","520","00:36:23:03","00:36:25:04","If that is the case,
try not to resent him."
"1","3","521","00:36:25:06","00:36:27:03","He gave ten years' worth
of his torrent of energy"
"1","3","522","00:36:27:05","00:36:29:04","to help your young master heal faster."
"1","3","523","00:36:29:23","00:36:31:20","Get some rest once you are done."
"1","3","524","00:36:35:17","00:36:37:18","Ten years' worth of his torrent of energy?"
"1","3","525","00:36:49:09","00:36:51:00","What took you so long?"
"1","3","526","00:36:51:02","00:36:53:05","Come here. This is wild ginseng--"
"1","3","527","00:36:54:03","00:36:55:05","What is it, Mu-deok?"
"1","3","528","00:36:55:07","00:36:57:00","What are you doing?"
"1","3","529","00:36:57:22","00:36:59:01","Stay still."
"1","3","530","00:36:59:23","00:37:01:23","This is not what I had in mind
when I brought you here."
"1","3","531","00:37:02:00","00:37:04:06","Mu-deok, this is wrong.
I am your pupil. Stop it."
"1","3","532","00:37:06:16","00:37:07:21","My gosh."
"1","3","533","00:37:12:22","00:37:14:09","What are you doing right now?"
"1","3","534","00:37:14:12","00:37:15:20","I am checking the core of your energy."
"1","3","535","00:37:17:22","00:37:19:00","Breathe properly."
"1","3","536","00:37:35:24","00:37:37:05","It is there."
"1","3","537","00:37:38:24","00:37:40:06","It really is inside."
"1","3","538","00:37:41:12","00:37:43:00","You really are special."
"1","3","539","00:37:43:16","00:37:44:22","Cut it out."
"1","3","540","00:37:45:12","00:37:47:09","What is inside my stomach?"
"1","3","541","00:37:47:11","00:37:48:23","A great torrent of energy."
"1","3","542","00:37:49:15","00:37:51:22","Heo Yeom placed a torrent of energy
in your stomach."
"1","3","543","00:37:53:21","00:37:55:05","A torrent of energy?"
"1","3","544","00:38:03:14","00:38:06:04","Uk seems to have recovered now."
"1","3","545","00:38:06:06","00:38:08:21","It is time you retrieve
the torrent of energy you gave him."
"1","3","546","00:38:08:23","00:38:12:01","If it surges the wrong way,
it could make him go mad."
"1","3","547","00:38:12:18","00:38:15:14","Uk will not be able to use it."
"1","3","548","00:38:16:11","00:38:18:15","His gate of energy just opened."
"1","3","549","00:38:18:17","00:38:21:03","There is nothing he can actually do."
"1","3","550","00:38:21:05","00:38:22:14","You are worried for nothing."
"1","3","551","00:38:23:06","00:38:27:17","He probably does not even know
that there is something great inside him."
"1","3","552","00:38:30:17","00:38:32:19","Let us steal Heo Yeom's torrent of energy."
"1","3","553","00:38:34:21","00:38:38:08","The core of your energy is filled
with the energy that Heo Yeom gave you."
"1","3","554","00:38:39:06","00:38:41:08","You are now strong enough
to use Jipsu with ease."
"1","3","555","00:38:41:11","00:38:44:05","I had no idea that
something so precious was inside me."
"1","3","556","00:38:44:07","00:38:47:14","It takes ten years to gather
this kind of torrent. You got it for free."
"1","3","557","00:38:47:16","00:38:49:21","And it is Heo Yeom's,
the best you could ask for."
"1","3","558","00:38:50:18","00:38:52:02","You are one lucky punk."
"1","3","559","00:38:52:05","00:38:56:11","I thought that old man hated me.
I am surprised he gave me this."
"1","3","560","00:38:56:13","00:38:59:13","He probably gave it to you
to help you recover."
"1","3","561","00:38:59:15","00:39:00:21","He will take it back soon."
"1","3","562","00:39:00:24","00:39:04:08","He cannot do that.
It is in my stomach, so it is mine."
"1","3","563","00:39:04:10","00:39:06:12","If you do not have
the power to control it,"
"1","3","564","00:39:06:14","00:39:09:11","it cannot become yours.
He can take it back whenever."
"1","3","565","00:39:09:13","00:39:12:04","To keep this, I need to be able
to control energy,"
"1","3","566","00:39:12:06","00:39:15:06","which means I need to breathe
just like the source of the energy."
"1","3","567","00:39:16:01","00:39:19:02","I guess those 12 masters
taught you a thing or two."
"1","3","568","00:39:20:04","00:39:21:07","Correct."
"1","3","569","00:39:22:14","00:39:25:14","The energy from your core
is controlled by your breathing."
"1","3","570","00:39:25:16","00:39:27:21","However, every mage breathes differently."
"1","3","571","00:39:27:23","00:39:31:15","There is a difference in how much air
one breathes in and out."
"1","3","572","00:39:32:18","00:39:36:12","It is Heo Yeom's energy,
so we must control it with his breathing."
"1","3","573","00:39:37:10","00:39:39:09","I doubt he will teach me."
"1","3","574","00:39:39:11","00:39:42:14","Should we just try everything?
After all, it is just breathing."
"1","3","575","00:39:43:08","00:39:46:17","If you use someone else's breathing,
you could lose control and go mad."
"1","3","576","00:39:47:11","00:39:51:15","You will shed blood
from every hole in your body and die."
"1","3","577","00:39:51:18","00:39:53:00","Should we still try?"
"1","3","578","00:39:54:05","00:39:55:01","No."
"1","3","579","00:39:55:20","00:39:58:06","You are way too extreme."
"1","3","580","00:39:59:03","00:40:02:07","Think of a way to keep me alive
along with this energy, Master."
"1","3","581","00:40:03:14","00:40:07:24","The most basic breathing skill
is handed down to you by your family."
"1","3","582","00:40:08:01","00:40:09:24","Heo Yeom is a member of the Seo family."
"1","3","583","00:40:10:01","00:40:13:05","So anyone from that family
will use the same breathing technique."
"1","3","584","00:40:16:13","00:40:17:17","-Seo Yul.
-Seo Yul."
"1","3","585","00:40:26:07","00:40:28:12","Go ask him. You said you were close."
"1","3","586","00:40:28:14","00:40:30:03","Yul is a careful guy."
"1","3","587","00:40:30:17","00:40:34:00","If I ask,
he will catch on and tell Heo Yeom."
"1","3","588","00:40:35:19","00:40:37:04","Just ten breaths…"
"1","3","589","00:40:37:06","00:40:39:24","No, seven will be enough."
"1","3","590","00:40:40:01","00:40:42:22","I will be able to know
by putting a hand on his core of energy."
"1","3","591","00:40:43:17","00:40:45:21","He will break your hand
before his first breath."
"1","3","592","00:40:46:13","00:40:49:06","You have a point. He is not like you."
"1","3","593","00:40:50:15","00:40:51:17","Me?"
"1","3","594","00:40:52:24","00:40:53:24","What is wrong with me?"
"1","3","595","00:40:56:01","00:40:59:11","What? What is with
that condescending look?"
"1","3","596","00:40:59:13","00:41:02:22","Anyway, I do not think
I can do to him what I did to you."
"1","3","597","00:41:02:24","00:41:04:10","No, wait. Mu-deok."
"1","3","598","00:41:04:12","00:41:06:01","Look at me in the eyes."
"1","3","599","00:41:06:03","00:41:09:11","So you feel uneasy about touching him
unlike how you felt with me?"
"1","3","600","00:41:09:13","00:41:12:03","You are so immature.
How is that even important?"
"1","3","601","00:41:12:17","00:41:13:20","""Immature""?"
"1","3","602","00:41:15:06","00:41:16:17","Yes, it is important."
"1","3","603","00:41:16:19","00:41:18:16","Are you insane? What are you doing?"
"1","3","604","00:41:18:19","00:41:19:14","I am sane."
"1","3","605","00:41:19:17","00:41:22:00","-No, let us say I am insane.
-Let go of me."
"1","3","606","00:41:24:22","00:41:25:19","What are you doing?"
"1","3","607","00:41:27:11","00:41:28:09","Hey."
"1","3","608","00:41:30:09","00:41:33:09","Why do you keep badgering Mu-deok?"
"1","3","609","00:41:33:24","00:41:35:00","She is still sick."
"1","3","610","00:41:35:02","00:41:37:03","I was not badgering her."
"1","3","611","00:41:38:17","00:41:40:05","-Seriously?
-Goodness."
"1","3","612","00:41:40:07","00:41:41:21","I thought you were being nice."
"1","3","613","00:41:43:05","00:41:44:19","Mu-deok, are you all right?"
"1","3","614","00:41:46:16","00:41:49:06","Your young master expects
a lot from you, does he not?"
"1","3","615","00:41:49:08","00:41:52:13","You not only need to care for him,
but you must keep him amused too."
"1","3","616","00:41:52:15","00:41:54:21","He asks for warm water,
but when I bring it,"
"1","3","617","00:41:54:23","00:41:56:08","he asks for cold water again…"
"1","3","618","00:41:56:10","00:41:58:07","-Hey, that--
-He says something is salty,"
"1","3","619","00:41:58:09","00:42:00:01","but later on, he complains it is bland."
"1","3","620","00:42:00:03","00:42:02:11","-Me?
-He is immature and fickle."
"1","3","621","00:42:02:13","00:42:04:22","He is lazy but full of himself."
"1","3","622","00:42:05:19","00:42:07:01","But what can I do?"
"1","3","623","00:42:07:03","00:42:08:10","He is my young master,"
"1","3","624","00:42:08:13","00:42:10:12","so I have no choice but to serve him."
"1","3","625","00:42:11:03","00:42:13:12","Mu-deok, you seem to know
a lot about him already."
"1","3","626","00:42:13:14","00:42:14:22","I am embarrassed for you."
"1","3","627","00:42:16:01","00:42:20:02","Anyway, what are you two doing here?
Why are you not at Sejukwon?"
"1","3","628","00:42:23:21","00:42:26:12","We were looking at Yul."
"1","3","629","00:42:26:14","00:42:27:19","Mu-deok asked me to come."
"1","3","630","00:42:30:05","00:42:31:05","Yul?"
"1","3","631","00:42:32:04","00:42:34:23","Why not go see him up close?"
"1","3","632","00:42:36:00","00:42:37:03","We were doing it in secret."
"1","3","633","00:42:37:18","00:42:41:08","Mu-deok seemed to feel uneasy
about approaching him,"
"1","3","634","00:42:41:10","00:42:42:14","so I stayed with her."
"1","3","635","00:42:45:18","00:42:49:03","Mu-deok, you must have feelings for Yul."
"1","3","636","00:42:49:05","00:42:51:06","-No--
-Dang-gu."
"1","3","637","00:42:51:07","00:42:53:04","You caught on very quickly."
"1","3","638","00:42:53:06","00:42:55:02","This is making me blush."
"1","3","639","00:42:55:04","00:42:58:15","-Young Master! This is a misunderstanding.
-Do not be shy."
"1","3","640","00:42:58:17","00:43:01:15","Many women have fallen for Yul."
"1","3","641","00:43:01:17","00:43:03:09","-It is natural you feel that way.
-It is not…"
"1","3","642","00:43:03:11","00:43:05:14","I will help Mu-deok."
"1","3","643","00:43:05:16","00:43:07:06","Uk, go to the reception room."
"1","3","644","00:43:07:08","00:43:08:13","Why?"
"1","3","645","00:43:09:03","00:43:10:04","Master Heo wants to see you."
"1","3","646","00:43:10:06","00:43:11:06","Master Heo?"
"1","3","647","00:43:34:16","00:43:36:22","Goodness."
"1","3","648","00:43:39:10","00:43:41:02","I heard you asked for me."
"1","3","649","00:43:43:06","00:43:44:06","Yes."
"1","3","650","00:43:44:21","00:43:47:09","The sound of your cough is nice and clear."
"1","3","651","00:43:47:11","00:43:49:05","I guess you are feeling much better."
"1","3","652","00:43:49:07","00:43:51:16","I still feel dizzy and nauseous."
"1","3","653","00:43:52:08","00:43:53:21","I also keep fainting."
"1","3","654","00:43:54:12","00:43:57:00","But I am getting better thanks to you."
"1","3","655","00:43:57:02","00:43:59:04","I saw you and your maid"
"1","3","656","00:43:59:06","00:44:03:02","energetically walking around this morning."
"1","3","657","00:44:03:04","00:44:04:17","How strange is that?"
